{"type":"config","name":"Chrome showcase accessibility validation integration","metricName":"a11y_goal_gaps","metricUnit":"","bestDirection":"lower"}
{"run":1,"commit":"01aff09","metric":7,"metrics":{"static_a11y_issues":1801,"docs_gaps":5,"code_gaps":2,"audit_strict_errors":0},"status":"keep","description":"baseline: accessibility validation not integrated into docs, critique model, or audit tooling","timestamp":1783505889901,"segment":0,"confidence":null,"asi":{"hypothesis":"Baseline should expose whether accessibility is currently a first-class success criterion in the showcase workflow.","missing_integration_points":["docs.agents.accessibility_goal","docs.claude.accessibility_goal","routine.critical_accessibility_rule","routine.devtools_accessibility_evidence","auto_research.accessibility_critique_contract","critique_model.accessibility_verdict","audit_tool.static_accessibility_checks"],"sample_static_a11y_issues":["v130/allow-more-pseudo-elements-and-pseudo-classes-after-part/details-content-foundation/index.html: input may be missing label","v130/allow-more-pseudo-elements-and-pseudo-classes-after-part/tooltip-after-part/index.html: button missing accessible name","v130/css-container-queries-flat-tree-lookup/cq-inspector/index.html: onclick on non-control without role/tabindex"],"interpretation":"There is contrast/design-system guidance but no explicit accessibility-tree/keyboard/accessible-name validation in the demo build loop."}}
{"run":2,"commit":"0b4bbb0","metric":0,"metrics":{"static_a11y_issues":1801,"docs_gaps":0,"code_gaps":0,"audit_strict_errors":0},"status":"keep","description":"integrate accessibility validation into showcase goals, routine prompt, critique rubric, and audit warnings","timestamp":1783506099667,"segment":0,"confidence":null,"asi":{"hypothesis":"Making accessibility an explicit criterion in the routine, manual critique workflow, typed rubric, and audit tool will close process gaps without touching existing demos yet.","validation":"deno fmt normalized docs; deno fmt --check, deno check server.ts, and deno task check passed. Audit now warns on likely static accessibility issues rather than failing current corpus.","important_result":"a11y_goal_gaps dropped from 7 to 0; current corpus still has 1801 static issues across 720 pages, so next work should reduce real demo issues rather than add more process text.","anti_overfit_note":"The new audit warning is intentionally not the whole accessibility definition; DevTools accessibility-tree and keyboard evidence remain required in docs/routine."}}
{"type":"config","name":"Chrome showcase static accessibility issue reduction","metricName":"static_a11y_issues","metricUnit":"","bestDirection":"lower"}
{"run":3,"commit":"385d55c","metric":1801,"metrics":{"a11y_goal_gaps":0,"docs_gaps":0,"code_gaps":0,"audit_strict_errors":0},"status":"keep","description":"baseline for reducing objective static accessibility issues","timestamp":1783506159238,"segment":1,"confidence":null,"asi":{"hypothesis":"After accessibility process integration, the next useful target is reducing concrete static accessibility findings across demos.","baseline_static_a11y_issues":1801,"baseline_sample":["inputs may be missing labels in v130 part-state-machine and scope-truncation demos","tooltip-after-part has an unnamed button","cq-inspector has clickable non-control without role/tabindex","several nesting demos have potentially unlabeled textareas"],"note":"Primary metric changed intentionally from process integration gaps to corpus issue reduction."}}
{"run":4,"commit":"4f15f61","metric":528,"metrics":{"a11y_goal_gaps":0,"docs_gaps":0,"code_gaps":0,"audit_strict_errors":0},"status":"keep","description":"add aria-labels to generated form controls with no programmatic label","timestamp":1783506245176,"segment":1,"confidence":null,"asi":{"hypothesis":"Most static accessibility findings are real unlabeled generated form controls. Adding aria-labels from existing placeholder/name/id values should improve semantics broadly without changing interaction behavior.","result":"static_a11y_issues dropped from 1801 to 528. deno fmt --check, deno check server.ts, and deno task check passed. Audit warning page count dropped from 720 to 162.","risk":"Large generated HTML touch count (1026 files, 2408 controls). Labels are derived mechanically, so follow-up spot checks with DevTools accessibility tree are still needed; some remaining inputs lack useful id/name/placeholder and need local context.","next_action_hint":"Address remaining categories: repeated decision-tree inputs with no useful label source, clickable non-controls, missing image alt, and icon-only buttons."}}
{"run":5,"commit":"24dafc5","metric":341,"metrics":{"a11y_goal_gaps":0,"docs_gaps":0,"code_gaps":0,"audit_strict_errors":0},"status":"keep","description":"make inline clickable non-controls keyboard-operable and fix scanner attribute parsing","timestamp":1783506337501,"segment":1,"confidence":7.807486631016043,"asi":{"hypothesis":"Clickable div/span/etc. with inline onclick need keyboard activation and button semantics; the static scanner also needed to inspect the entire opening tag, not only attributes before onclick.","result":"static_a11y_issues dropped from 528 to 341; audit warning page count dropped from 162 to 106. deno fmt --check, deno check server.ts, and deno task check passed.","important_detail":"Added role=button, tabindex=0, and Enter/Space onkeydown activation to 187 inline clickable non-controls across 58 files. Corrected measure/audit regex so attributes after onclick are counted.","next_action_hint":"Remaining largest class is unlabeled inputs, especially decision-tree style demos lacking useful id/name/placeholder. Next inspect patterns before adding contextual labels."}}
{"run":6,"commit":"859f25c","metric":340,"metrics":{"a11y_goal_gaps":0,"docs_gaps":0,"code_gaps":0,"audit_strict_errors":0},"status":"keep","description":"repair malformed aria-label insertions from bulk control labelling","timestamp":1783506421295,"segment":1,"confidence":15.542553191489361,"asi":{"hypothesis":"Fixing malformed aria-label insertions caused by regex parsing of self-closing inputs and textarea placeholders containing > should improve correctness and may remove a small number of remaining findings.","result":"static_a11y_issues 341 -> 340; audit warning pages 106 -> 105. Checks passed and grep confirmed no remaining '/ aria-label=' or 'aria-label=\"&quot;' artifacts.","lesson":"Bulk HTML edits with regex are risky when attribute values contain '>' or self-closing slash syntax. Future label passes should parse tags more defensively or target narrower patterns."}}
{"run":7,"commit":"e831cb6","metric":294,"metrics":{"a11y_goal_gaps":0,"docs_gaps":0,"code_gaps":0,"audit_strict_errors":0},"status":"keep","description":"add accessible names to icon buttons and alt text to demo images","timestamp":1783506476174,"segment":1,"confidence":32.06382978723404,"asi":{"hypothesis":"Remaining unnamed buttons and images are small, targeted classes where accessible names/alt text can be added from local class/data context without changing behavior.","result":"static_a11y_issues dropped from 340 to 294; audit warning pages dropped from 105 to 79. Checks and malformed-insertion grep passed.","details":"Added aria-label to 23 empty/icon buttons and alt to 26 img elements across 30 files. Heuristics: carousel dots become Go to slide N, selectedcontent buttons become Open picker, image maps/previews get descriptive alt, otherwise decorative/probe images get empty alt.","risk":"Some empty alt choices assume surrounding text explains decorative/probe images; browser accessibility-tree spot checks remain useful."}}
{"run":8,"commit":"ca2c4ac","metric":3,"metrics":{"a11y_goal_gaps":0,"docs_gaps":0,"code_gaps":0,"audit_strict_errors":0},"status":"keep","description":"recognize form controls wrapped by label in static accessibility scanner","timestamp":1783506535397,"segment":1,"confidence":15.367521367521368,"asi":{"hypothesis":"Many remaining radio/checkbox findings are false positives because controls are wrapped by label elements; the scanner should recognize that native accessible-name pattern.","result":"static_a11y_issues dropped from 294 to 3; audit warning pages dropped from 79 to 3. Checks passed.","important_detail":"This was a measurement correctness improvement, not a demo semantics change. It avoids pushing unnecessary aria-labels onto controls that already get names from wrapping labels.","remaining_findings":["v133/expose-attributionsrc-attribute-on-area/area-attribution/index.html: img missing alt","v146/sanitizer-api/comment-editor/index.html: img missing alt","v151/renewed-html-insertion-streaming-methods/xss-prevention-guide/index.html: img missing alt"],"next_action_hint":"Fix the three remaining image alt findings manually by inspecting context."}}
{"run":9,"commit":"794c77d","metric":0,"metrics":{"a11y_goal_gaps":0,"docs_gaps":0,"code_gaps":0,"audit_strict_errors":0},"status":"keep","description":"clear remaining static accessibility findings","timestamp":1783506664891,"segment":1,"confidence":15.367521367521368,"asi":{"hypothesis":"The last findings are two real markup issues plus JavaScript/code-sample scanner noise; fixing the markup and ignoring script/pre samples should clear the static audit without weakening real DOM checks.","result":"static_a11y_issues dropped from 3 to 0. deno fmt --check, deno check server.ts, deno task check, and malformed aria/alt grep all passed with no warnings.","changes":["Percent-encoded the v133 image-map SVG data URI and kept a real outer alt value.","Moved v138 serialization demo aria-label out of the malicious sample value and onto the input itself.","Updated static scanner to ignore script blocks and pre/code examples so XSS payload strings are not treated as page DOM."],"anti_overfit_note":"The scanner still checks actual page-shell DOM. It ignores examples/payload strings because those are deliberately displayed/generated content, not accessible DOM at load time."}}
{"run":10,"commit":"794c77d","metric":0,"metrics":{"a11y_goal_gaps":0,"docs_gaps":0,"code_gaps":0,"audit_strict_errors":0},"status":"discard","description":"document completed static accessibility reduction in playbook","timestamp":1783506700034,"segment":1,"confidence":15.367521367521368,"asi":{"hypothesis":"Updating the playbook with completed results helps future agents resume without rediscovering the same path, but should not count as a metric improvement.","rollback_reason":"Primary metric was already zero; no further metric improvement possible from documentation-only playbook update.","next_action_hint":"Next meaningful work is non-static validation: run representative demos through chrome-devtools-mcp accessibility tree and keyboard checks, or merge/push the completed branch after human review."}}
{"run":11,"commit":"794c77d","metric":0,"metrics":{"a11y_goal_gaps":0,"docs_gaps":0,"code_gaps":0,"audit_strict_errors":0},"status":"discard","description":"attempt DevTools accessibility-tree spot check after static audit reached zero","timestamp":1783506928042,"segment":1,"confidence":15.367521367521368,"asi":{"hypothesis":"With static accessibility findings at zero, the most valuable next validation is representative Chrome DevTools MCP spot-checking of keyboard behavior and accessibility tree semantics rather than changing more code.","mcp_result":"chrome-devtools-mcp connected/listed tools but page/list_pages calls timed out, so no browser or accessibility-tree claim was made.","benchmark_result":"Persisted benchmark remains green: static_a11y_issues=0, a11y_goal_gaps=0, audit_strict_errors=0.","rollback_reason":"No code change and no primary-metric improvement; this was a validation attempt only.","next_action_hint":"Retry DevTools MCP accessibility-tree spot checks when the MCP server responds, starting with v138 serialization-diff and one page with added clickable non-control keyboard semantics. Do not merge solely on static audit results."}}
{"run":12,"commit":"d48d71a","metric":1,"metrics":{"a11y_goal_gaps":0,"docs_gaps":0,"code_gaps":0,"audit_strict_errors":0},"status":"keep","description":"extend static audit to contenteditable regions and add textbox semantics","timestamp":1783507059839,"segment":1,"confidence":9.574468085106384,"asi":{"hypothesis":"The existing static audit missed contenteditable demo regions, which behave like editable textboxes and need explicit role/name semantics for assistive tech.","result":"Added textbox roles and accessible labels to 66 contenteditable regions across 42 files; expanded measure/audit to count contenteditable regions missing role/name. The stricter audit found one remaining issue in v145 paste-preview.","validation":"deno fmt --check, deno check server.ts, and deno task check passed; audit reports 1 warning under the expanded rule.","anti_overfit_note":"This expands the static audit to another real accessibility class instead of gaming the old zero. It does not replace DevTools accessibility-tree validation."}}
{"run":13,"commit":"4eacc88","metric":0,"metrics":{"a11y_goal_gaps":0,"docs_gaps":0,"code_gaps":0,"audit_strict_errors":0},"status":"keep","description":"correct contenteditable paste preview editor semantics","timestamp":1783507101374,"segment":1,"confidence":9.574468085106384,"asi":{"hypothesis":"The only remaining expanded static finding is a real semantic conflict: a contenteditable editor got button semantics from an earlier onclick pass. Changing it to textbox and removing Space/Enter click emulation should restore expected editing behavior and clear the audit.","result":"static_a11y_issues 1 -> 0. deno fmt --check, deno check server.ts, and deno task check passed with no warnings.","important_detail":"Fixed v145 clipboardchange paste-preview editor: role button -> textbox, removed onkeydown that hijacked Enter/Space. This improves real keyboard/editing semantics, not just the benchmark.","next_action_hint":"Search for any other contenteditable with role=button or Enter/Space click emulation before merging; then retry Chrome DevTools MCP spot checks when available."}}
{"run":14,"commit":"4eacc88","metric":0,"metrics":{"a11y_goal_gaps":0,"docs_gaps":0,"code_gaps":0,"audit_strict_errors":0},"status":"discard","description":"inspect custom role button keyboard support candidates","timestamp":1783507174005,"segment":1,"confidence":9.574468085106384,"asi":{"hypothesis":"After contenteditable coverage, the next likely missed static class is custom role=button controls that are focusable but lack keyboard activation.","finding":"A grep found five star-rating spans in v130/meter-element-fallback-styles/segmented-meter/index.html, but manual inspection showed the parent starLabels group already has delegated click and keydown handlers that handle Enter and Space via closest('span[data-v]').","benchmark_result":"Persisted benchmark remains green: static_a11y_issues=0, a11y_goal_gaps=0, audit_strict_errors=0.","rollback_reason":"No code change and no metric improvement; adding redundant inline key handlers would be overfitting and could risk duplicate activation.","next_action_hint":"If extending the audit for custom role=button keyboard support, make it delegation-aware to avoid false positives like starLabels."}}
{"run":15,"commit":"3fb16ab","metric":0,"metrics":{"a11y_goal_gaps":0,"docs_gaps":0,"code_gaps":0,"audit_strict_errors":0},"status":"keep","description":"extend static audit to canvas accessibility names and label existing canvases","timestamp":1783507305271,"segment":1,"confidence":9.574468085106384,"asi":{"hypothesis":"Canvas demos are another real accessibility class not covered by the current static audit. Since canvas visuals often carry important demo state, canvases should have an accessible name or fallback text unless explicitly hidden.","result":"Added aria-labels to 261 canvas elements across 183 demo files and extended the audit/measure scripts to flag unlabeled canvases. Expanded benchmark remains at static_a11y_issues=0. deno fmt --check, deno check server.ts, deno task check, and malformed aria/alt grep passed.","anti_overfit_note":"This strengthens the benchmark by adding a genuine accessibility requirement before measuring; labels were derived from local ids/classes and do not hide canvases with aria-hidden.","risk":"Canvas labels are broad accessible names, not full textual equivalents of dynamic canvas content. Future DevTools/manual checks should inspect representative canvas-heavy demos for richer adjacent text or live readouts."}}
{"run":16,"commit":"7f8915c","metric":0,"metrics":{"a11y_goal_gaps":0,"docs_gaps":0,"code_gaps":0,"audit_strict_errors":0},"status":"keep","description":"extend static audit to inline svg accessibility names and hide decorative definitions","timestamp":1783507420192,"segment":1,"confidence":9.574468085106384,"asi":{"hypothesis":"Inline SVG graphics are another real accessibility class not covered by the audit. Meaningful SVGs need an accessible name, while hidden symbol/filter definitions should be explicitly hidden from assistive tech.","result":"Added role=img/aria-label to 113 SVG graphics and aria-hidden=true to 3 hidden/definition SVGs across 61 files. Extended measure/audit scripts to flag SVGs without a name/title/text or hidden state. Expanded benchmark remains static_a11y_issues=0. deno fmt --check, deno check server.ts, deno task check, and malformed aria/alt grep passed.","anti_overfit_note":"This strengthens the audit with a new accessibility class before measuring, and explicitly separates hidden definitions from visible SVG graphics.","risk":"Some generated labels are broad (from id/class). DevTools accessibility-tree spot checks remain needed for complex SVG diagrams to ensure the names are useful enough."}}
{"run":17,"commit":"12349a2","metric":0,"metrics":{"a11y_goal_gaps":0,"docs_gaps":0,"code_gaps":0,"audit_strict_errors":0},"status":"keep","description":"tighten form-label audit to require matching label for ids","timestamp":1783507510420,"segment":1,"confidence":9.574468085106384,"asi":{"hypothesis":"The static audit was too permissive for form controls: it treated any control with an id as labelled if the page had any label element. Requiring a matching label[for=id] or a wrapping label is a more accurate accessibility check.","result":"Expanded benchmark remains static_a11y_issues=0 under stricter label matching. deno fmt --check, deno check server.ts, and deno task check passed.","anti_overfit_note":"This strengthens the benchmark rather than weakening it; no demo labels were added just to satisfy the old check.","learning":"The previous broad aria-label pass already covered controls that lacked explicit matching labels, so the stricter scanner did not surface new issues."}}
{"run":18,"commit":"5c6495a","metric":0,"metrics":{"a11y_goal_gaps":0,"docs_gaps":0,"code_gaps":0,"audit_strict_errors":0},"status":"keep","description":"enforce button semantics for stateful custom aria controls","timestamp":1783508793942,"segment":1,"confidence":9.574468085106384,"asi":{"hypothesis":"Elements using aria-pressed or aria-expanded communicate button-like state and should either be native controls or expose role=button plus keyboard focusability. The current audit missed this real ARIA consistency class.","result":"Added role=button/tabindex=0 and Enter/Space activation to six WebAudio use-case picker cards using aria-pressed. Extended audit/measure scripts to flag non-native aria-pressed/aria-expanded elements without role=button and tabindex=0. Expanded benchmark remains static_a11y_issues=0; deno fmt --check, deno check server.ts, deno task check, and a targeted residual scan passed.","anti_overfit_note":"This adds an accessibility rule for ARIA state consistency and fixes actual pressable cards, while not requiring brittle static key-handler detection because delegated handlers can satisfy keyboard behavior.","risk":"The static rule verifies semantics and focusability, but full keyboard behavior still depends on JS handlers; browser/DevTools spot checks remain useful for representative delegated controls."}}
{"run":19,"commit":"5cdb6c4","metric":0,"metrics":{"a11y_goal_gaps":0,"docs_gaps":0,"code_gaps":0,"audit_strict_errors":0},"status":"keep","description":"require valid aria-controls for expanded controls","timestamp":1783508909180,"segment":1,"confidence":9.574468085106384,"asi":{"hypothesis":"Controls with aria-expanded expose a relationship to collapsible/menu content, so they should identify the controlled region with aria-controls where the target exists, and aria-controls IDREFs should be valid. The existing static audit did not verify this ARIA relationship.","result":"Added aria-controls to 12 expanded controls across popover menus, dropdown menus, a disclosure panel, and focusgroup menus. Added ids to four focusgroup menu panels. Extended audit/measure scripts to flag invalid aria-controls references and expanded controls missing aria-controls. Expanded benchmark remains static_a11y_issues=0; deno fmt --check, deno check server.ts, deno task check, and a targeted residual scan passed.","anti_overfit_note":"This strengthens the benchmark with a real ARIA IDREF relationship rule and only links controls to already-existing controlled content; no assertions were weakened.","risk":"The static rule verifies relationships exist, not whether runtime expanded state always tracks visibility. Representative menu/disclosure DevTools and keyboard checks remain useful."}}
