{"run":38,"commit":"3ab690b","metric":0,"metrics":{"a11y_goal_gaps":0,"docs_gaps":0,"code_gaps":0,"audit_strict_errors":0},"status":"keep","description":"validate aria-sort and autocomplete tokens in static audit","timestamp":1783534945068,"segment":1,"confidence":9.574468085106384,"asi":{"hypothesis":"aria-sort and aria-autocomplete have constrained token sets that affect how assistive technologies announce sortable columns and text-entry suggestion behavior. Invalid tokens silently degrade interaction semantics, so the static audit should validate them. The current corpus has no uses, making this a future regression guard rather than a benchmark-specific fix.","next_action_hint":"Continue expanding high-confidence value validation, but consider refactoring repeated ARIA token checks into a small table-driven helper before adding many more attributes."}}
{"run":39,"commit":"5fed835","metric":0,"metrics":{"a11y_goal_gaps":0,"docs_gaps":0,"code_gaps":0,"audit_strict_errors":0},"status":"keep","description":"validate aria-invalid and relevant tokens in static audit","timestamp":1783534991950,"segment":1,"confidence":9.574468085106384,"asi":{"hypothesis":"aria-invalid and aria-relevant have constrained token sets that affect how assistive technologies announce validation errors and live-region changes. Invalid values silently degrade those announcements, so the static audit should validate legal single-token aria-invalid values and legal aria-relevant token lists. The current corpus has no uses, making this a future regression guard rather than a benchmark-specific fix.","next_action_hint":"Refactor the growing ARIA token checks into table-driven helpers before adding more value rules, so the audit remains maintainable and future extensions are less error-prone."}}
{"run":40,"commit":"7e1e885","metric":0,"metrics":{"a11y_goal_gaps":0,"docs_gaps":0,"code_gaps":0,"audit_strict_errors":0},"status":"keep","description":"refactor ARIA token validation into table-driven audit helper","timestamp":1783535053944,"segment":1,"confidence":9.574468085106384,"asi":{"hypothesis":"The static audit now validates many constrained ARIA tokens, and leaving them as repeated inline conditionals makes future extensions error-prone. Refactoring the checks into a table-driven helper should preserve the current zero-issue behavior while improving maintainability and reducing the risk of mistakes when adding future ARIA value rules.","next_action_hint":"With token validation centralized, continue adding high-confidence ARIA value rules only when they map to real assistive-technology semantics, or shift to live-region/status semantics and required relationship checks that the helper now makes easier to maintain."}}
{"run":41,"commit":"5ab7364","metric":0,"metrics":{"a11y_goal_gaps":0,"docs_gaps":0,"code_gaps":0,"audit_strict_errors":0},"status":"keep","description":"validate numeric ARIA range values in static audit","timestamp":1783535113473,"segment":1,"confidence":9.574468085106384,"asi":{"hypothesis":"ARIA range attributes such as aria-valuemin, aria-valuemax, and aria-valuenow expose numeric widget state to assistive technologies. Non-numeric values, inverted min/max ranges, or a current value outside the declared range would silently misrepresent slider/progress state, so the static audit should validate these numeric constraints. Existing uses are valid, making this a real regression guard rather than a benchmark-specific fix.","next_action_hint":"Consider validating custom range widgets more holistically next: role=slider, role=progressbar, and role=spinbutton should have accessible names and appropriate value semantics, while avoiding false positives for native progress/meter elements already covered."}}
{"run":42,"commit":"6b813f1","metric":0,"metrics":{"a11y_goal_gaps":0,"docs_gaps":0,"code_gaps":0,"audit_strict_errors":0},"status":"keep","description":"require names and values for custom ARIA range widgets","timestamp":1783535171054,"segment":1,"confidence":9.574468085106384,"asi":{"hypothesis":"Custom ARIA range widgets such as slider, spinbutton, scrollbar, meter, and progressbar expose value state to assistive technologies only when they have accessible names and appropriate ARIA value semantics. The static audit should catch unnamed custom range widgets, missing current values for operable range controls, and missing focusability for non-native interactive range widgets. The current corpus has no custom range roles, so this is a regression guard rather than a benchmark-specific fix.","next_action_hint":"Look for other widget-specific required semantics that can be checked statically without overreaching, such as combobox/listbox relationships or menu/menubar item structure."}}
{"run":43,"commit":"7b1e43a","metric":0,"metrics":{"a11y_goal_gaps":0,"docs_gaps":0,"code_gaps":0,"audit_strict_errors":0},"status":"keep","description":"require basic combobox and listbox semantics in static audit","timestamp":1783535232588,"segment":1,"confidence":9.574468085106384,"asi":{"hypothesis":"Custom combobox and listbox widgets are easy to make visually functional while exposing incomplete semantics to assistive technologies. The static audit should require combobox names, expanded state, valid controlled content when declared, focusability for non-native combobox hosts, and listboxes with owned or inline option children. The current corpus has no static combobox/listbox roles, so this is a regression guard rather than a benchmark-specific fix.","next_action_hint":"Continue with menu and menubar structure checks: named menus are already covered, but static analysis can also require menu/menubar containers to contain or own menuitem-like children without overreaching into browser-only behavior."}}
{"run":44,"commit":"97b16d0","metric":0,"metrics":{"a11y_goal_gaps":0,"docs_gaps":0,"code_gaps":0,"audit_strict_errors":0},"status":"keep","description":"require menu structure and checked states in static audit","timestamp":1783535286839,"segment":1,"confidence":9.574468085106384,"asi":{"hypothesis":"Custom menu and menubar containers expose composite widget structure to assistive technologies only when they contain or own menuitem-like descendants, and checkbox/radio menuitems need valid checked state. The static audit should catch empty custom menus and unnamed or state-missing menuitem variants. The current corpus has no static menu/menubar containers after code/script stripping, so this is a regression guard rather than a benchmark-specific fix.","next_action_hint":"Continue with tree/treeitem structure checks or grid/table ARIA widget checks where required children, names, and selected/expanded state can be verified statically without simulating browser interaction."}}
{"run":45,"commit":"3574d0a","metric":0,"metrics":{"a11y_goal_gaps":0,"docs_gaps":0,"code_gaps":0,"audit_strict_errors":0},"status":"keep","description":"require tree widgets to contain or own treeitems in static audit","timestamp":1783535336291,"segment":1,"confidence":9.574468085106384,"asi":{"hypothesis":"Custom ARIA tree widgets expose hierarchical navigation only when the tree container contains or owns treeitem descendants. A named but empty tree role would be misleading to assistive technologies, so the static audit should catch tree containers without inline or owned treeitems. The current corpus has no static tree roles after script/code stripping, so this is a regression guard rather than a benchmark-specific fix.","next_action_hint":"Continue with grid/table ARIA widget checks: role=grid/table containers should contain or own row descendants, and rows should expose cell/gridcell/columnheader/rowheader children where static markup makes that verifiable."}}
{"run":46,"commit":"6316964","metric":0,"metrics":{"a11y_goal_gaps":0,"docs_gaps":0,"code_gaps":0,"audit_strict_errors":0},"status":"keep","description":"require ARIA grid and table widget structure in static audit","timestamp":1783535386549,"segment":1,"confidence":9.574468085106384,"asi":{"hypothesis":"Custom ARIA grid and table widgets expose tabular structure to assistive technologies only when grid/table containers contain or own row or rowgroup descendants, rowgroups contain rows, and rows contain cell-like children. The static audit should catch empty or structurally incomplete ARIA table widgets. The current corpus has no custom ARIA grid/table roles after script/code stripping, so this is a regression guard rather than a benchmark-specific fix.","next_action_hint":"Continue with structural ARIA checks that are high-confidence, such as feed/list/listitem ownership or required names for landmark-like roles, but avoid duplicating native HTML table/list semantics already covered elsewhere."}}
{"run":47,"commit":"62448dc","metric":0,"metrics":{"a11y_goal_gaps":0,"docs_gaps":0,"code_gaps":0,"audit_strict_errors":0},"status":"keep","description":"require custom ARIA list and feed item structure in static audit","timestamp":1783535436770,"segment":1,"confidence":9.574468085106384,"asi":{"hypothesis":"Custom ARIA list and feed containers expose collection structure to assistive technologies only when they contain or own the appropriate item roles. The static audit should catch role=list without listitem descendants and role=feed without article descendants. The current corpus has no custom list/feed roles after script/code stripping, so this is a regression guard rather than a benchmark-specific fix.","next_action_hint":"Consider required-name checks for landmark-like roles such as region, navigation, complementary, search, form, and banner/contentinfo/main uniqueness, but keep the checks conservative to avoid duplicating native page structure semantics."}}
{"run":48,"commit":"f2945ad","metric":0,"metrics":{"a11y_goal_gaps":0,"docs_gaps":0,"code_gaps":0,"audit_strict_errors":0},"status":"keep","description":"require names for explicit form and region landmarks in static audit","timestamp":1783535487781,"segment":1,"confidence":9.574468085106384,"asi":{"hypothesis":"Explicit ARIA form and region landmarks are only useful as navigable landmarks when assistive technology users can identify their purpose. Requiring aria-label, aria-labelledby, or title for role=form and role=region is a conservative static check that avoids overreaching into native page structure or uniqueness of global landmarks. The current corpus has no explicit form/region roles after script/code stripping, so this is a regression guard rather than a benchmark-specific fix.","next_action_hint":"Consider adding a small helper for repeated role-child structure checks, or continue with conservative landmark checks only where ARIA requires or strongly expects names."}}
{"run":49,"commit":"b8c0837","metric":0,"metrics":{"a11y_goal_gaps":0,"docs_gaps":0,"code_gaps":0,"audit_strict_errors":0},"status":"keep","description":"refactor ARIA child-role structure checks into helper","timestamp":1783535545150,"segment":1,"confidence":9.574468085106384,"asi":{"hypothesis":"The static audit now has several ARIA container-to-child structural rules, and repeating regex checks inline makes future additions harder to review. Refactoring those rules into table-driven required-child maps plus a shared helper should preserve zero-issue behavior while making the audit easier to extend safely and less prone to inconsistent role patterns.","next_action_hint":"Continue with conservative required-name checks for specific ARIA roles or add table-driven comments/documentation around why each static ARIA check is safe, rather than broadening into behavior that needs DevTools accessibility-tree verification."}}
{"run":50,"commit":"52a88d5","metric":0,"metrics":{"a11y_goal_gaps":0,"docs_gaps":0,"code_gaps":0,"audit_strict_errors":0},"status":"keep","description":"centralize explicit accessible-name checks in static audit","timestamp":1783535594516,"segment":1,"confidence":9.574468085106384,"asi":{"hypothesis":"The audit uses two subtly different name concepts: any accessible name, where descendant text can count, and explicit names for roles like region, group, tabpanel, and role=img where descendant text should not satisfy the rule. Centralizing the explicit-name check should preserve behavior while making future role-specific rules easier to review and less likely to accidentally accept the wrong naming source.","next_action_hint":"Continue with conservative required-name or structural checks only where the explicit-name distinction is clear, or add comments documenting which ARIA checks intentionally require explicit names versus descendant text."}}
{"run":51,"commit":"2766c80","metric":0,"metrics":{"a11y_goal_gaps":0,"docs_gaps":0,"code_gaps":0,"audit_strict_errors":0},"status":"keep","description":"document explicit accessible-name semantics in static audit","timestamp":1783543230754,"segment":1,"confidence":9.574468085106384,"asi":{"hypothesis":"The static audit now distinguishes explicit purpose labels from descendant text names. A short in-code explanation should reduce the chance that future ARIA checks accidentally accept visible content as a landmark/widget purpose label, preserving stricter accessibility semantics while keeping the metric unchanged.","next_action_hint":"Continue immediately with another conservative static audit improvement, preferably a behavior-preserving maintainability refactor or a high-confidence role-specific check that can be scanned against the corpus before adding."}}
