{"run":20,"commit":"385cdb8","metric":0,"metrics":{"a11y_goal_gaps":0,"docs_gaps":0,"code_gaps":0,"audit_strict_errors":0},"status":"keep","description":"validate aria IDREFs and page-shell duplicate ids","timestamp":1783509070473,"segment":1,"confidence":9.574468085106384,"asi":{"hypothesis":"Accessible names/descriptions and ARIA relationships can silently fail when aria-labelledby or aria-describedby reference missing IDs, and duplicate IDs in the page shell can make IDREF resolution ambiguous. The existing audit only checked that name attributes existed, not that their references were valid.","result":"Fixed one broken aria-labelledby reference by replacing it with an explicit aria-label, and resolved a real main-document duplicate id in the Temporal timezone demo by renaming the transition result element and its JS/CSS references. Extended audit/measure scripts to strip srcdoc payloads before page-shell ID checks, flag duplicate page-shell IDs, and validate aria-controls/aria-labelledby/aria-describedby references. Expanded benchmark remains static_a11y_issues=0; deno fmt --check, deno check server.ts, deno task check, and targeted residual scan passed.","anti_overfit_note":"The scanner deliberately strips srcdoc attributes before duplicate-ID checks so separate iframe documents are not incorrectly treated as the parent DOM; this avoids false positives while enforcing real page-shell ID integrity.","risk":"Regex-based parsing still cannot replace browser DOM inspection for dynamically generated IDs or runtime ARIA changes. DevTools spot checks remain useful for pages with generated controls."}}
{"run":21,"commit":"2c67d0d","metric":0,"metrics":{"a11y_goal_gaps":0,"docs_gaps":0,"code_gaps":0,"audit_strict_errors":0},"status":"keep","description":"prevent aria-hidden on focusable page-shell elements","timestamp":1783509318727,"segment":1,"confidence":9.574468085106384,"asi":{"hypothesis":"aria-hidden=true on focusable elements hides reachable UI from assistive technologies. The static audit should catch high-confidence cases where the hidden element itself is focusable, without overreaching into descendant checks that require DOM parsing.","result":"Converted two visual-only themed button samples to non-interactive spans and replaced a hidden tabindexed iframe with a titled cross-realm test iframe. Extended audit/measure scripts to flag aria-hidden=true on focusable page-shell elements. Expanded benchmark remains static_a11y_issues=0; deno fmt --check, deno check server.ts, deno task check, and targeted residual scan passed.","anti_overfit_note":"The first broad descendant rule produced false positives on decorative SVGs due regex over-capture, so the kept rule is deliberately narrower and high-confidence rather than tuned to hide failures.","risk":"aria-hidden ancestors containing focusable descendants are still a real class but need real DOM parsing or DevTools inspection to avoid false positives; this remains a promising future improvement."}}
{"run":22,"commit":"4eb7460","metric":0,"metrics":{"a11y_goal_gaps":0,"docs_gaps":0,"code_gaps":0,"audit_strict_errors":0},"status":"keep","description":"require accessible names for non-hidden iframes","timestamp":1783509437471,"segment":1,"confidence":9.574468085106384,"asi":{"hypothesis":"Non-hidden iframe elements need accessible names so assistive technology users can identify the frame purpose. The static audit previously checked images, SVGs, canvases, and controls but not frames.","result":"Added titles to 27 non-hidden iframes across 24 demo pages and moved six titles before long srcdoc attributes so the lightweight page-shell scanner can parse them reliably. Extended audit/measure scripts to flag non-hidden iframes without title/aria-label/aria-labelledby. Expanded benchmark remains static_a11y_issues=0; deno fmt --check, deno check server.ts, deno task check, and targeted residual scan passed.","anti_overfit_note":"This adds a standard frame-accessible-name requirement and fixes real unnamed browsing contexts. Titles are semantic descriptions of the frame purpose, not hidden benchmark-only attributes.","risk":"Some frame titles are concise and derived from local demo context; DevTools accessibility-tree review can still assess whether complex embedded demos need more descriptive names."}}
{"run":23,"commit":"ca055f2","metric":0,"metrics":{"a11y_goal_gaps":0,"docs_gaps":0,"code_gaps":0,"audit_strict_errors":0},"status":"keep","description":"require accessible names for progress and meter indicators","timestamp":1783509536075,"segment":1,"confidence":9.574468085106384,"asi":{"hypothesis":"Native progress and meter elements expose values to assistive technologies, but without an accessible name users may not know what value is being reported. The audit covered controls and media-like elements but not these value indicators.","result":"Added accessible names to 24 progress/meter elements across 12 demo files using local purpose such as battery level, audio level, connection delay, theme match progress, and accent progress. Extended audit/measure scripts to flag non-hidden progress/meter elements without aria-label/aria-labelledby/title or a real label. Expanded benchmark remains static_a11y_issues=0; deno fmt --check, deno check server.ts, deno task check, and targeted residual scan passed.","anti_overfit_note":"This adds a standard accessible-name requirement for native value indicators and labels actual visible indicators rather than weakening scanner logic.","risk":"Some labels are concise and derived from local demo context; richer surrounding explanatory text may still be needed for complex performance dashboards during DevTools accessibility-tree review."}}
{"run":24,"commit":"1c47124","metric":0,"metrics":{"a11y_goal_gaps":0,"docs_gaps":0,"code_gaps":0,"audit_strict_errors":0},"status":"keep","description":"require accessible names for visible audio and video elements","timestamp":1783509760875,"segment":1,"confidence":9.574468085106384,"asi":{"hypothesis":"Visible audio and video elements, especially controls and live previews, should have accessible names so assistive technology users can distinguish embedded media demos. The static audit covered iframes and value indicators but not media elements.","result":"Added accessible names to 53 page-shell audio/video elements across 47 demo files and extended audit/measure scripts to flag visible non-hidden media elements without title/aria-label/aria-labelledby. Also corrected srcdoc stripping to run before script/pre stripping so iframe payload media is not counted as parent-page DOM. Expanded benchmark remains static_a11y_issues=0; deno fmt --check, deno check server.ts, deno task check, and targeted residual scan passed.","anti_overfit_note":"The rule targets visible page-shell media only and deliberately strips srcdoc before scanning, avoiding false positives from separate iframe documents while enforcing real media names.","risk":"Some labels are concise and derived from ids/classes; complex media demos may still need fuller surrounding text or captions/transcripts assessed via browser/DevTools review."}}
{"run":25,"commit":"905f865","metric":0,"metrics":{"a11y_goal_gaps":0,"docs_gaps":0,"code_gaps":0,"audit_strict_errors":0},"status":"keep","description":"require accessible names for custom role img elements","timestamp":1783509827857,"segment":1,"confidence":9.574468085106384,"asi":{"hypothesis":"Custom visual composites using role=img need an accessible name, just like native image-like elements. The audit covered img/svg/canvas/media but did not enforce ARIA role=img naming.","result":"Added role=img accessible-name validation to both audit and measure scripts. No existing page-shell role=img elements were unnamed, so the expanded benchmark remains static_a11y_issues=0. deno fmt --check, deno check server.ts, deno task check, and a targeted residual scan passed.","anti_overfit_note":"This strengthens the benchmark with a standard ARIA naming rule without changing demo markup or weakening any checks.","risk":"The rule validates only the presence of a role=img name; DevTools/browser review is still needed to judge whether names for complex visual composites are sufficiently descriptive."}}
{"run":26,"commit":"53f146a","metric":0,"metrics":{"a11y_goal_gaps":0,"docs_gaps":0,"code_gaps":0,"audit_strict_errors":0},"status":"keep","description":"require accessible names for custom role button controls","timestamp":1783510023104,"segment":1,"confidence":9.574468085106384,"asi":{"hypothesis":"Non-native elements with role=button are exposed as controls and should have an accessible name, just like native buttons. The audit covered native buttons and state semantics but did not explicitly validate names for arbitrary custom buttons.","result":"Added explicit accessible names to empty color swatch controls, a polygon canvas action target, a popover backdrop close target, and timeline milestone custom buttons. Extended audit/measure scripts to flag non-hidden custom role=button elements without aria-label/aria-labelledby/title or visible text. Expanded benchmark remains static_a11y_issues=0; deno fmt --check, deno check server.ts, deno task check, and targeted residual scan passed.","anti_overfit_note":"The rule enforces the same accessible-name expectation as native buttons for real custom controls. Labels describe the actual action or selection target rather than satisfying a keyword-only benchmark.","risk":"Regex-based paired-tag parsing can still be imperfect for deeply nested custom controls; browser accessibility-tree review remains the authority for computed names."}}
{"run":27,"commit":"fa9f16a","metric":0,"metrics":{"a11y_goal_gaps":0,"docs_gaps":0,"code_gaps":0,"audit_strict_errors":0},"status":"keep","description":"enforce basic ARIA tab semantics in static audit","timestamp":1783510126849,"segment":1,"confidence":9.574468085106384,"asi":{"hypothesis":"Elements with role=tab are custom interactive controls and should expose an accessible name, selected state, and focus management. The audit already covered custom buttons but not tab semantics.","result":"Added role=tab validation to both audit and measure scripts: non-hidden tabs must have an accessible name, aria-selected=true/false, and tabindex=0/-1 when not native button/link elements. No existing tabs failed the stricter rule, so expanded benchmark remains static_a11y_issues=0. deno fmt --check, deno check server.ts, deno task check, and targeted residual scan passed.","anti_overfit_note":"This strengthens the benchmark with standard ARIA tab requirements without changing demo markup or weakening checks.","risk":"The static rule does not validate full tablist keyboard behavior such as arrow-key navigation or panel visibility synchronization; DevTools/browser keyboard review remains needed for tabbed widgets."}}
{"run":28,"commit":"d20e839","metric":0,"metrics":{"a11y_goal_gaps":0,"docs_gaps":0,"code_gaps":0,"audit_strict_errors":0},"status":"keep","description":"require accessible names for dialog containers","timestamp":1783510261622,"segment":1,"confidence":9.574468085106384,"asi":{"hypothesis":"Visible dialog and alertdialog containers should expose accessible names so assistive technology users know what modal or panel opened. The audit covered many controls and media-like elements but did not validate dialog container naming.","result":"Added aria-labels to 66 dialog elements across 42 demo files using local IDs/classes and feature context. Extended audit/measure scripts to flag visible dialog/alertdialog containers without title/aria-label/aria-labelledby. Expanded benchmark remains static_a11y_issues=0; deno fmt --check, deno check server.ts, deno task check, and targeted residual scan passed.","anti_overfit_note":"This adds a standard dialog naming requirement and labels actual modal containers with their local purpose rather than weakening the scanner.","risk":"Some generated dialog labels are concise. Browser accessibility-tree review is still needed to verify the final computed names and focus behavior for complex dialog stacks."}}
{"run":29,"commit":"924152a","metric":0,"metrics":{"a11y_goal_gaps":0,"docs_gaps":0,"code_gaps":0,"audit_strict_errors":0},"status":"keep","description":"require accessible names for data tables","timestamp":1783510419985,"segment":1,"confidence":9.574468085106384,"asi":{"hypothesis":"Visible data/result tables should expose an accessible name via caption or ARIA so screen reader users know what dataset or comparison the table represents. The audit previously covered many widgets but not table naming.","result":"Added accessible names to 644 visible data tables across the demo corpus, mostly derived from table ids/classes or header cells, with two targeted manual labels for remaining tables. Extended audit/measure scripts to flag visible non-presentational tables without caption/title/aria-label/aria-labelledby. Expanded benchmark remains static_a11y_issues=0; deno fmt --check, deno check server.ts, deno task check, and targeted residual scan passed.","anti_overfit_note":"This adds a standard data-table naming requirement and labels actual table purposes rather than hiding tables or weakening checks. Presentational/hidden tables are skipped.","risk":"This is a large corpus-wide metadata pass. Labels are concise and mechanically derived for many tables, so DevTools/manual review should sample representative tables to ensure names are useful, not merely present."}}
{"run":30,"commit":"950fea3","metric":0,"metrics":{"a11y_goal_gaps":0,"docs_gaps":0,"code_gaps":0,"audit_strict_errors":0},"status":"keep","description":"require accessible names for fieldset control groups","timestamp":1783510554410,"segment":1,"confidence":9.574468085106384,"asi":{"hypothesis":"Visible fieldsets group related form controls and should have a legend or accessible name so assistive technology users understand the group purpose. The static audit checked individual controls but not group naming.","result":"Added an accessible name to the one unnamed fieldset in the form lifecycle demo and extended audit/measure scripts to flag visible fieldsets without legend/title/aria-label/aria-labelledby. Expanded benchmark remains static_a11y_issues=0; deno fmt --check, deno check server.ts, deno task check, and targeted residual scan passed.","anti_overfit_note":"This adds a standard grouped-control naming requirement and fixes the actual form-control group rather than changing benchmark expectations.","risk":"The fix uses aria-label rather than a visible legend to preserve the demo layout; manual review could decide a visible legend is preferable for users who do not use assistive tech."}}
{"run":31,"commit":"86e19ec","metric":0,"metrics":{"a11y_goal_gaps":0,"docs_gaps":0,"code_gaps":0,"audit_strict_errors":0},"status":"keep","description":"enforce names and state for composite ARIA widgets in static audit","timestamp":1783534605590,"segment":1,"confidence":9.574468085106384,"asi":{"hypothesis":"Composite ARIA widgets such as listbox, menu, radiogroup, toolbar, tree, option, menuitem, radio, and treeitem expose interactive structure to assistive technologies, so the static audit should require accessible group names, item names, and required selected/checked/focus state where applicable. The current corpus appears compliant, so this broadens regression coverage without adding benchmark-only fixes.","next_action_hint":"Continue expanding the static audit toward other high-confidence ARIA contracts, such as tabpanel labelling/relationships or status/live-region naming, while preserving DevTools/browser review as the non-static validation layer."}}
{"run":32,"commit":"314a787","metric":0,"metrics":{"a11y_goal_gaps":0,"docs_gaps":0,"code_gaps":0,"audit_strict_errors":0},"status":"keep","description":"validate ARIA tab and tabpanel relationships in static audit","timestamp":1783534662728,"segment":1,"confidence":9.574468085106384,"asi":{"hypothesis":"ARIA tab interfaces require more than named tabs: tabs that declare aria-controls should point at real tabpanel elements, and tabpanels should be named by a real tab or another accessible label. Adding this static relationship check broadens real regression coverage without modifying demos or weakening browser-review requirements.","next_action_hint":"Continue with other high-confidence semantic contracts that static analysis can verify, such as aria-activedescendant IDREF validity and ownership/focus patterns for composite widgets."}}
{"run":33,"commit":"227ba80","metric":0,"metrics":{"a11y_goal_gaps":0,"docs_gaps":0,"code_gaps":0,"audit_strict_errors":0},"status":"keep","description":"validate aria-activedescendant references with cross-root exception","timestamp":1783534723956,"segment":1,"confidence":9.574468085106384,"asi":{"hypothesis":"aria-activedescendant is an IDREF that assistive technologies rely on for composite-widget focus. The static audit should validate that it resolves, while explicitly allowing Chrome 133 Reference Target demos where a custom element exposes a shadow-root target via shadowRootReferenceTarget/shadowrootreferencetarget. This broadens real regression coverage without penalizing the spec feature being demonstrated.","next_action_hint":"Look for other ARIA IDREF-style contracts not yet covered, such as aria-owns relationships for composite widgets or role=status/alert live-region semantics, and prefer checks that can distinguish intentional advanced patterns from broken references."}}
{"run":34,"commit":"fafe8f4","metric":0,"metrics":{"a11y_goal_gaps":0,"docs_gaps":0,"code_gaps":0,"audit_strict_errors":0},"status":"keep","description":"validate aria-owns IDREF targets in static audit","timestamp":1783534764895,"segment":1,"confidence":9.574468085106384,"asi":{"hypothesis":"aria-owns is an ARIA IDREFS relationship that changes the accessibility tree ownership order. If it references missing IDs, assistive technology relationships silently break, so the static audit should validate it alongside aria-controls, aria-labelledby, aria-describedby, and aria-activedescendant. The corpus currently has no aria-owns uses, making this a pure regression guard rather than a benchmark-specific demo fix.","next_action_hint":"Continue with high-confidence ARIA value validation, such as legal aria-haspopup tokens or aria-live values, because those can be checked statically without requiring broad DOM simulation."}}
{"run":35,"commit":"f58689e","metric":0,"metrics":{"a11y_goal_gaps":0,"docs_gaps":0,"code_gaps":0,"audit_strict_errors":0},"status":"keep","description":"validate aria-haspopup tokens in static audit","timestamp":1783534808573,"segment":1,"confidence":9.574468085106384,"asi":{"hypothesis":"aria-haspopup values are constrained ARIA tokens that tell assistive technologies which popup pattern a control opens. Invalid values silently degrade the announced interaction model, so the static audit should require one of true, false, menu, listbox, tree, grid, or dialog. Existing uses are valid, making this a regression guard rather than a corpus-specific fix.","next_action_hint":"Continue with similarly high-confidence ARIA value validation such as aria-live, aria-current, and aria-orientation token checks, or add role=status/alert live-region semantic coverage where it can be verified statically."}}
{"run":36,"commit":"445825e","metric":0,"metrics":{"a11y_goal_gaps":0,"docs_gaps":0,"code_gaps":0,"audit_strict_errors":0},"status":"keep","description":"validate aria-live current and orientation tokens in static audit","timestamp":1783534849162,"segment":1,"confidence":9.574468085106384,"asi":{"hypothesis":"aria-live, aria-current, and aria-orientation use constrained token sets that affect how assistive technologies announce updates, current location, and widget direction. Invalid values silently degrade semantics, so the static audit should validate these tokens. The current corpus already uses valid values, making this a real regression guard rather than a benchmark-specific fix.","next_action_hint":"Continue with high-confidence ARIA value validation for boolean/tristate attributes such as aria-disabled, aria-expanded, aria-pressed, aria-selected, and aria-checked, while being careful about mixed for tri-state controls."}}
{"run":37,"commit":"1de5873","metric":0,"metrics":{"a11y_goal_gaps":0,"docs_gaps":0,"code_gaps":0,"audit_strict_errors":0},"status":"keep","description":"validate boolean and tristate ARIA values in static audit","timestamp":1783534901855,"segment":1,"confidence":9.574468085106384,"asi":{"hypothesis":"Boolean and tristate ARIA attributes drive exposed control state and live-region state in assistive technologies. Invalid tokens on aria-disabled, aria-expanded, aria-hidden, aria-modal, aria-multiline, aria-multiselectable, aria-required, aria-selected, aria-busy, aria-pressed, or aria-checked silently degrade semantics, so the static audit should validate their legal value sets. Existing corpus values are already valid, making this a regression guard rather than a benchmark-specific fix.","next_action_hint":"Continue with other constrained ARIA value checks such as aria-sort and aria-autocomplete, or consider required name/state checks for role=status/alert/live regions where static analysis can stay high-confidence."}}
